rank,title,genre,description,director,actors,year,runtime,rating,votes,revenue,metascore,text
233,Apocalypto,"Action,Adventure,Drama","As the Mayan kingdom faces its decline, the rulers insist the key to prosperity is to build more temples and offer human sacrifices. Jaguar Paw, a young man captured for sacrifice, flees to avoid his fate.",Mel Gibson,"Gerardo Taracena, Raoul Max Trujillo, Dalia Hernández,Rudy Youngblood",2006,139,7.8,247926,50.86,68.0,"Título: Apocalypto. Géneros: Action,Adventure,Drama. Director: Mel Gibson. Actores: Gerardo Taracena, Raoul Max Trujillo, Dalia Hernández,Rudy Youngblood. Año: 2006. Rating: 7.8. Sinopsis: As the Mayan kingdom faces its decline, the rulers insist the key to prosperity is to build more temples and offer human sacrifices. Jaguar Paw, a young man captured for sacrifice, flees to avoid his fate.."
234,Mission: Impossible - Rogue Nation,"Action,Adventure,Thriller","Ethan and team take on their most impossible mission yet, eradicating the Syndicate - an International rogue organization as highly skilled as they are, committed to destroying the IMF.",Christopher McQuarrie,"Tom Cruise, Rebecca Ferguson, Jeremy Renner, Simon Pegg",2015,131,7.4,257472,195.0,75.0,"Título: Mission: Impossible - Rogue Nation. Géneros: Action,Adventure,Thriller. Director: Christopher McQuarrie. Actores: Tom Cruise, Rebecca Ferguson, Jeremy Renner, Simon Pegg. Año: 2015. Rating: 7.4. Sinopsis: Ethan and team take on their most impossible mission yet, eradicating the Syndicate - an International rogue organization as highly skilled as they are, committed to destroying the IMF.."
235,The Huntsman: Winter's War,"Action,Adventure,Drama","Eric and fellow warrior Sara, raised as members of ice Queen Freya's army, try to conceal their forbidden love as they fight to survive the wicked intentions of both Freya and her sister Ravenna.",Cedric Nicolas-Troyan,"Chris Hemsworth, Jessica Chastain, Charlize Theron, Emily Blunt",2016,114,6.1,66766,47.95,35.0,"Título: The Huntsman: Winter's War. Géneros: Action,Adventure,Drama. Director: Cedric Nicolas-Troyan. Actores: Chris Hemsworth, Jessica Chastain, Charlize Theron, Emily Blunt. Año: 2016. Rating: 6.1. Sinopsis: Eric and fellow warrior Sara, raised as members of ice Queen Freya's army, try to conceal their forbidden love as they fight to survive the wicked intentions of both Freya and her sister Ravenna.."
236,The Perks of Being a Wallflower,"Drama,Romance",An introvert freshman is taken under the wings of two seniors who welcome him to the real world.,Stephen Chbosky,"Logan Lerman, Emma Watson, Ezra Miller, Paul Rudd",2012,102,8.0,377336,17.74,67.0,"Título: The Perks of Being a Wallflower. Géneros: Drama,Romance. Director: Stephen Chbosky. Actores: Logan Lerman, Emma Watson, Ezra Miller, Paul Rudd. Año: 2012. Rating: 8.0. Sinopsis: An introvert freshman is taken under the wings of two seniors who welcome him to the real world.."
237,Jackie,"Biography,Drama,History","Following the assassination of President John F. Kennedy, First Lady Jacqueline Kennedy fights through grief and trauma to regain her faith, console her children, and define her husband's historic legacy.",Pablo Larraín,"Natalie Portman, Peter Sarsgaard, Greta Gerwig,Billy Crudup",2016,100,6.8,41446,13.96,81.0,"Título: Jackie. Géneros: Biography,Drama,History. Director: Pablo Larraín. Actores: Natalie Portman, Peter Sarsgaard, Greta Gerwig,Billy Crudup. Año: 2016. Rating: 6.8. Sinopsis: Following the assassination of President John F. Kennedy, First Lady Jacqueline Kennedy fights through grief and trauma to regain her faith, console her children, and define her husband's historic legacy.."
238,The Disappointments Room,"Drama,Horror,Thriller",A mother and her young son release unimaginable horrors from the attic of their rural dream home.,D.J. Caruso,"Kate Beckinsale, Mel Raido, Duncan Joiner, Lucas Till",2016,85,3.9,4895,2.41,31.0,"Título: The Disappointments Room. Géneros: Drama,Horror,Thriller. Director: D.J. Caruso. Actores: Kate Beckinsale, Mel Raido, Duncan Joiner, Lucas Till. Año: 2016. Rating: 3.9. Sinopsis: A mother and her young son release unimaginable horrors from the attic of their rural dream home.."
239,The Grand Budapest Hotel,"Adventure,Comedy,Drama","The adventures of Gustave H, a legendary concierge at a famous hotel from the fictional Republic of Zubrowka between the first and second World Wars, and Zero Moustafa, the lobby boy who becomes his most trusted friend.",Wes Anderson,"Ralph Fiennes, F. Murray Abraham, Mathieu Amalric,Adrien Brody",2014,99,8.1,530881,59.07,88.0,"Título: The Grand Budapest Hotel. Géneros: Adventure,Comedy,Drama. Director: Wes Anderson. Actores: Ralph Fiennes, F. Murray Abraham, Mathieu Amalric,Adrien Brody. Año: 2014. Rating: 8.1. Sinopsis: The adventures of Gustave H, a legendary concierge at a famous hotel from the fictional Republic of Zubrowka between the first and second World Wars, and Zero Moustafa, the lobby boy who becomes his most trusted friend.."
240,The Host,"Action,Adventure,Romance","When an unseen enemy threatens mankind by taking over their bodies and erasing their memories, Melanie will risk everything to protect the people she cares most about, proving that love can conquer all in a dangerous new world.",Andrew Niccol,"Saoirse Ronan, Max Irons, Jake Abel, Diane Kruger",2013,125,5.9,96852,26.62,35.0,"Título: The Host. Géneros: Action,Adventure,Romance. Director: Andrew Niccol. Actores: Saoirse Ronan, Max Irons, Jake Abel, Diane Kruger. Año: 2013. Rating: 5.9. Sinopsis: When an unseen enemy threatens mankind by taking over their bodies and erasing their memories, Melanie will risk everything to protect the people she cares most about, proving that love can conquer all in a dangerous new world.."
241,Fury,"Action,Drama,War","A grizzled tank commander makes tough decisions as he and his crew fight their way across Germany in April, 1945.",David Ayer,"Brad Pitt, Shia LaBeouf, Logan Lerman, Michael Peña",2014,134,7.6,332234,85.71,64.0,"Título: Fury. Géneros: Action,Drama,War. Director: David Ayer. Actores: Brad Pitt, Shia LaBeouf, Logan Lerman, Michael Peña. Año: 2014. Rating: 7.6. Sinopsis: A grizzled tank commander makes tough decisions as he and his crew fight their way across Germany in April, 1945.."
242,Inside Out,"Animation,Adventure,Comedy","After young Riley is uprooted from her Midwest life and moved to San Francisco, her emotions - Joy, Fear, Anger, Disgust and Sadness - conflict on how best to navigate a new city, house, and school.",Pete Docter,"Amy Poehler, Bill Hader, Lewis Black, Mindy Kaling",2015,95,8.2,416689,356.45,94.0,"Título: Inside Out. Géneros: Animation,Adventure,Comedy. Director: Pete Docter. Actores: Amy Poehler, Bill Hader, Lewis Black, Mindy Kaling. Año: 2015. Rating: 8.2. Sinopsis: After young Riley is uprooted from her Midwest life and moved to San Francisco, her emotions - Joy, Fear, Anger, Disgust and Sadness - conflict on how best to navigate a new city, house, and school.."
243,Rock Dog,"Animation,Adventure,Comedy","When a radio falls from the sky into the hands of a wide-eyed Tibetan Mastiff, he leaves home to fulfill his dream of becoming a musician, setting into motion a series of completely unexpected events.",Ash Brannon,"Luke Wilson, Eddie Izzard, J.K. Simmons, Lewis Black",2016,90,5.8,1109,9.4,48.0,"Título: Rock Dog. Géneros: Animation,Adventure,Comedy. Director: Ash Brannon. Actores: Luke Wilson, Eddie Izzard, J.K. Simmons, Lewis Black. Año: 2016. Rating: 5.8. Sinopsis: When a radio falls from the sky into the hands of a wide-eyed Tibetan Mastiff, he leaves home to fulfill his dream of becoming a musician, setting into motion a series of completely unexpected events.."
244,Terminator Genisys,"Action,Adventure,Sci-Fi","When John Connor, leader of the human resistance, sends Sgt. Kyle Reese back to 1984 to protect Sarah Connor and safeguard the future, an unexpected turn of events creates a fractured timeline.",Alan Taylor,"Arnold Schwarzenegger, Jason Clarke, Emilia Clarke,Jai Courtney",2015,126,6.5,205365,89.73,38.0,"Título: Terminator Genisys. Géneros: Action,Adventure,Sci-Fi. Director: Alan Taylor. Actores: Arnold Schwarzenegger, Jason Clarke, Emilia Clarke,Jai Courtney. Año: 2015. Rating: 6.5. Sinopsis: When John Connor, leader of the human resistance, sends Sgt. Kyle Reese back to 1984 to protect Sarah Connor and safeguard the future, an unexpected turn of events creates a fractured timeline.."
245,Percy Jackson & the Olympians: The Lightning Thief,"Adventure,Family,Fantasy",A teenager discovers he's the descendant of a Greek god and sets out on an adventure to settle an on-going battle between the gods.,Chris Columbus,"Logan Lerman, Kevin McKidd, Steve Coogan,Brandon T. Jackson",2010,118,5.9,148949,88.76,47.0,"Título: Percy Jackson & the Olympians: The Lightning Thief. Géneros: Adventure,Family,Fantasy. Director: Chris Columbus. Actores: Logan Lerman, Kevin McKidd, Steve Coogan,Brandon T. Jackson. Año: 2010. Rating: 5.9. Sinopsis: A teenager discovers he's the descendant of a Greek god and sets out on an adventure to settle an on-going battle between the gods.."
246,Les Misérables,"Drama,Musical,Romance","In 19th-century France, Jean Valjean, who for decades has been hunted by the ruthless policeman Javert after breaking parole, agrees to care for a factory worker's daughter. The decision changes their lives forever.",Tom Hooper,"Hugh Jackman, Russell Crowe, Anne Hathaway,Amanda Seyfried",2012,158,7.6,257426,148.78,63.0,"Título: Les Misérables. Géneros: Drama,Musical,Romance. Director: Tom Hooper. Actores: Hugh Jackman, Russell Crowe, Anne Hathaway,Amanda Seyfried. Año: 2012. Rating: 7.6. Sinopsis: In 19th-century France, Jean Valjean, who for decades has been hunted by the ruthless policeman Javert after breaking parole, agrees to care for a factory worker's daughter. The decision changes their lives forever.."
247,Children of Men,"Drama,Sci-Fi,Thriller","In 2027, in a chaotic world in which women have become somehow infertile, a former activist agrees to help transport a miraculously pregnant woman to a sanctuary at sea.",Alfonso Cuarón,"Julianne Moore, Clive Owen, Chiwetel Ejiofor,Michael Caine",2006,109,7.9,382910,35.29,84.0,"Título: Children of Men. Géneros: Drama,Sci-Fi,Thriller. Director: Alfonso Cuarón. Actores: Julianne Moore, Clive Owen, Chiwetel Ejiofor,Michael Caine. Año: 2006. Rating: 7.9. Sinopsis: In 2027, in a chaotic world in which women have become somehow infertile, a former activist agrees to help transport a miraculously pregnant woman to a sanctuary at sea.."
248,20th Century Women,"Comedy,Drama","The story of a teenage boy, his mother, and two other women who help raise him among the love and freedom of Southern California of 1979.",Mike Mills,"Annette Bening, Elle Fanning, Greta Gerwig, Billy Crudup",2016,119,7.4,14708,5.66,83.0,"Título: 20th Century Women. Géneros: Comedy,Drama. Director: Mike Mills. Actores: Annette Bening, Elle Fanning, Greta Gerwig, Billy Crudup. Año: 2016. Rating: 7.4. Sinopsis: The story of a teenage boy, his mother, and two other women who help raise him among the love and freedom of Southern California of 1979.."
249,Spy,"Action,Comedy,Crime","A desk-bound CIA analyst volunteers to go undercover to infiltrate the world of a deadly arms dealer, and prevent diabolical global disaster.",Paul Feig,"Melissa McCarthy, Rose Byrne, Jude Law, Jason Statham",2015,119,7.1,188017,110.82,75.0,"Título: Spy. Géneros: Action,Comedy,Crime. Director: Paul Feig. Actores: Melissa McCarthy, Rose Byrne, Jude Law, Jason Statham. Año: 2015. Rating: 7.1. Sinopsis: A desk-bound CIA analyst volunteers to go undercover to infiltrate the world of a deadly arms dealer, and prevent diabolical global disaster.."
250,The Intouchables,"Biography,Comedy,Drama","After he becomes a quadriplegic from a paragliding accident, an aristocrat hires a young man from the projects to be his caregiver.",Olivier Nakache,"François Cluzet, Omar Sy, Anne Le Ny, Audrey Fleurot",2011,112,8.6,557965,13.18,57.0,"Título: The Intouchables. Géneros: Biography,Comedy,Drama. Director: Olivier Nakache. Actores: François Cluzet, Omar Sy, Anne Le Ny, Audrey Fleurot. Año: 2011. Rating: 8.6. Sinopsis: After he becomes a quadriplegic from a paragliding accident, an aristocrat hires a young man from the projects to be his caregiver.."
251,Bonjour Anne,"Comedy,Drama,Romance","Anne is at a crossroads in her life. Long married to a successful, driven but inattentive movie producer, she unexpectedly finds herself taking a car trip from Cannes to Paris with a ... See full summary »",Eleanor Coppola,"Diane Lane, Alec Baldwin, Arnaud Viard, Linda Gegusch",2016,92,4.9,178,0.32,50.0,"Título: Bonjour Anne. Géneros: Comedy,Drama,Romance. Director: Eleanor Coppola. Actores: Diane Lane, Alec Baldwin, Arnaud Viard, Linda Gegusch. Año: 2016. Rating: 4.9. Sinopsis: Anne is at a crossroads in her life. Long married to a successful, driven but inattentive movie producer, she unexpectedly finds herself taking a car trip from Cannes to Paris with a ... See full summary »."
252,Kynodontas,"Drama,Thriller","Three teenagers live isolated, without leaving their house, because their over-protective parents say they can only leave when their dogtooth falls out.",Yorgos Lanthimos,"Christos Stergioglou, Michele Valley, Angeliki Papoulia, Hristos Passalis",2009,94,7.3,50946,0.11,73.0,"Título: Kynodontas. Géneros: Drama,Thriller. Director: Yorgos Lanthimos. Actores: Christos Stergioglou, Michele Valley, Angeliki Papoulia, Hristos Passalis. Año: 2009. Rating: 7.3. Sinopsis: Three teenagers live isolated, without leaving their house, because their over-protective parents say they can only leave when their dogtooth falls out.."
253,Straight Outta Compton,"Biography,Drama,History","The group NWA emerges from the mean streets of Compton in Los Angeles, California, in the mid-1980s and revolutionizes Hip Hop culture with their music and tales about life in the hood.",F. Gary Gray,"O'Shea Jackson Jr., Corey Hawkins, Jason Mitchell,Neil Brown Jr.",2015,147,7.9,139831,161.03,72.0,"Título: Straight Outta Compton. Géneros: Biography,Drama,History. Director: F. Gary Gray. Actores: O'Shea Jackson Jr., Corey Hawkins, Jason Mitchell,Neil Brown Jr.. Año: 2015. Rating: 7.9. Sinopsis: The group NWA emerges from the mean streets of Compton in Los Angeles, California, in the mid-1980s and revolutionizes Hip Hop culture with their music and tales about life in the hood.."
254,The Amazing Spider-Man 2,"Action,Adventure,Sci-Fi","When New York is put under siege by Oscorp, it is up to Spider-Man to save the city he swore to protect as well as his loved ones.",Marc Webb,"Andrew Garfield, Emma Stone, Jamie Foxx, Paul Giamatti",2014,142,6.7,342183,202.85,53.0,"Título: The Amazing Spider-Man 2. Géneros: Action,Adventure,Sci-Fi. Director: Marc Webb. Actores: Andrew Garfield, Emma Stone, Jamie Foxx, Paul Giamatti. Año: 2014. Rating: 6.7. Sinopsis: When New York is put under siege by Oscorp, it is up to Spider-Man to save the city he swore to protect as well as his loved ones.."
255,The Conjuring,"Horror,Mystery,Thriller",Paranormal investigators Ed and Lorraine Warren work to help a family terrorized by a dark presence in their farmhouse.,James Wan,"Patrick Wilson, Vera Farmiga, Ron Livingston, Lili Taylor",2013,112,7.5,330305,137.39,68.0,"Título: The Conjuring. Géneros: Horror,Mystery,Thriller. Director: James Wan. Actores: Patrick Wilson, Vera Farmiga, Ron Livingston, Lili Taylor. Año: 2013. Rating: 7.5. Sinopsis: Paranormal investigators Ed and Lorraine Warren work to help a family terrorized by a dark presence in their farmhouse.."
256,The Hangover,Comedy,"Three buddies wake up from a bachelor party in Las Vegas, with no memory of the previous night and the bachelor missing. They make their way around the city in order to find their friend before his wedding.",Todd Phillips,"Zach Galifianakis, Bradley Cooper, Justin Bartha, Ed Helms",2009,100,7.8,611563,277.31,73.0,"Título: The Hangover. Géneros: Comedy. Director: Todd Phillips. Actores: Zach Galifianakis, Bradley Cooper, Justin Bartha, Ed Helms. Año: 2009. Rating: 7.8. Sinopsis: Three buddies wake up from a bachelor party in Las Vegas, with no memory of the previous night and the bachelor missing. They make their way around the city in order to find their friend before his wedding.."
257,Battleship,"Action,Adventure,Sci-Fi",A fleet of ships is forced to do battle with an armada of unknown origins in order to discover and thwart their destructive goals.,Peter Berg,"Alexander Skarsgård, Brooklyn Decker, Liam Neeson,Rihanna",2012,131,5.8,210349,65.17,41.0,"Título: Battleship. Géneros: Action,Adventure,Sci-Fi. Director: Peter Berg. Actores: Alexander Skarsgård, Brooklyn Decker, Liam Neeson,Rihanna. Año: 2012. Rating: 5.8. Sinopsis: A fleet of ships is forced to do battle with an armada of unknown origins in order to discover and thwart their destructive goals.."
258,Rise of the Planet of the Apes,"Action,Drama,Sci-Fi","A substance, designed to help the brain repair itself, gives rise to a super-intelligent chimp who leads an ape uprising.",Rupert Wyatt,"James Franco, Andy Serkis, Freida Pinto, Karin Konoval",2011,105,7.6,422290,176.74,68.0,"Título: Rise of the Planet of the Apes. Géneros: Action,Drama,Sci-Fi. Director: Rupert Wyatt. Actores: James Franco, Andy Serkis, Freida Pinto, Karin Konoval. Año: 2011. Rating: 7.6. Sinopsis: A substance, designed to help the brain repair itself, gives rise to a super-intelligent chimp who leads an ape uprising.."
259,Lights Out,Horror,"Rebecca must unlock the terror behind her little brother's experiences that once tested her sanity, bringing her face to face with an entity attached to their mother.",David F. Sandberg,"Teresa Palmer, Gabriel Bateman, Maria Bello,Billy Burke",2016,81,6.4,69823,67.24,58.0,"Título: Lights Out. Géneros: Horror. Director: David F. Sandberg. Actores: Teresa Palmer, Gabriel Bateman, Maria Bello,Billy Burke. Año: 2016. Rating: 6.4. Sinopsis: Rebecca must unlock the terror behind her little brother's experiences that once tested her sanity, bringing her face to face with an entity attached to their mother.."
260,Norman: The Moderate Rise and Tragic Fall of a New York Fixer,"Drama,Thriller","Norman Oppenheimer is a small time operator who befriends a young politician at a low point in his life. Three years later, when the politician becomes an influential world leader, Norman's life dramatically changes for better and worse.",Joseph Cedar,"Richard Gere, Lior Ashkenazi, Michael Sheen,Charlotte Gainsbourg",2016,118,7.1,664,2.27,76.0,"Título: Norman: The Moderate Rise and Tragic Fall of a New York Fixer. Géneros: Drama,Thriller. Director: Joseph Cedar. Actores: Richard Gere, Lior Ashkenazi, Michael Sheen,Charlotte Gainsbourg. Año: 2016. Rating: 7.1. Sinopsis: Norman Oppenheimer is a small time operator who befriends a young politician at a low point in his life. Three years later, when the politician becomes an influential world leader, Norman's life dramatically changes for better and worse.."
261,Birdman or (The Unexpected Virtue of Ignorance),"Comedy,Drama,Romance","Illustrated upon the progress of his latest Broadway play, a former popular actor's struggle to cope with his current life as a wasted actor is shown.",Alejandro González Iñárritu,"Michael Keaton, Zach Galifianakis,Edward Norton, Andrea Riseborough",2014,119,7.8,440299,42.34,88.0,"Título: Birdman or (The Unexpected Virtue of Ignorance). Géneros: Comedy,Drama,Romance. Director: Alejandro González Iñárritu. Actores: Michael Keaton, Zach Galifianakis,Edward Norton, Andrea Riseborough. Año: 2014. Rating: 7.8. Sinopsis: Illustrated upon the progress of his latest Broadway play, a former popular actor's struggle to cope with his current life as a wasted actor is shown.."
262,Black Swan,"Drama,Thriller","A committed dancer wins the lead role in a production of Tchaikovsky's ""Swan Lake"" only to find herself struggling to maintain her sanity.",Darren Aronofsky,"Natalie Portman, Mila Kunis, Vincent Cassel,Winona Ryder",2010,108,8.0,581518,106.95,79.0,"Título: Black Swan. Géneros: Drama,Thriller. Director: Darren Aronofsky. Actores: Natalie Portman, Mila Kunis, Vincent Cassel,Winona Ryder. Año: 2010. Rating: 8.0. Sinopsis: A committed dancer wins the lead role in a production of Tchaikovsky's ""Swan Lake"" only to find herself struggling to maintain her sanity.."
263,Dear White People,"Comedy,Drama",The lives of four black students at an Ivy League college.,Justin Simien,"Tyler James Williams, Tessa Thompson, Kyle Gallner,Teyonah Parris",2014,108,6.2,21715,4.4,79.0,"Título: Dear White People. Géneros: Comedy,Drama. Director: Justin Simien. Actores: Tyler James Williams, Tessa Thompson, Kyle Gallner,Teyonah Parris. Año: 2014. Rating: 6.2. Sinopsis: The lives of four black students at an Ivy League college.."
264,Nymphomaniac: Vol. I,Drama,A self-diagnosed nymphomaniac recounts her erotic experiences to the man who saved her after a beating.,Lars von Trier,"Charlotte Gainsbourg, Stellan Skarsgård, Stacy Martin, Shia LaBeouf",2013,117,7.0,90556,0.79,64.0,"Título: Nymphomaniac: Vol. I. Géneros: Drama. Director: Lars von Trier. Actores: Charlotte Gainsbourg, Stellan Skarsgård, Stacy Martin, Shia LaBeouf. Año: 2013. Rating: 7.0. Sinopsis: A self-diagnosed nymphomaniac recounts her erotic experiences to the man who saved her after a beating.."
265,Teenage Mutant Ninja Turtles: Out of the Shadows,"Action,Adventure,Comedy","After facing Shredder, who has joined forces with mad scientist Baxter Stockman and henchmen Bebop and Rocksteady to take over the world, the Turtles must confront an even greater nemesis: the notorious Krang.",Dave Green,"Megan Fox, Will Arnett, Tyler Perry, Laura Linney",2016,112,6.0,59312,0.54,40.0,"Título: Teenage Mutant Ninja Turtles: Out of the Shadows. Géneros: Action,Adventure,Comedy. Director: Dave Green. Actores: Megan Fox, Will Arnett, Tyler Perry, Laura Linney. Año: 2016. Rating: 6.0. Sinopsis: After facing Shredder, who has joined forces with mad scientist Baxter Stockman and henchmen Bebop and Rocksteady to take over the world, the Turtles must confront an even greater nemesis: the notorious Krang.."
266,Knock Knock,"Drama,Horror,Thriller","A devoted father helps two stranded young women who knock on his door, but his kind gesture turns into a dangerous seduction and a deadly game of cat and mouse.",Eli Roth,"Keanu Reeves, Lorenza Izzo, Ana de Armas, Aaron Burns",2015,99,4.9,53441,0.03,53.0,"Título: Knock Knock. Géneros: Drama,Horror,Thriller. Director: Eli Roth. Actores: Keanu Reeves, Lorenza Izzo, Ana de Armas, Aaron Burns. Año: 2015. Rating: 4.9. Sinopsis: A devoted father helps two stranded young women who knock on his door, but his kind gesture turns into a dangerous seduction and a deadly game of cat and mouse.."
267,Dirty Grandpa,Comedy,"Right before his wedding, an uptight guy is tricked into driving his grandfather, a lecherous former Army Lieutenant-Colonel, to Florida for spring break.",Dan Mazer,"Robert De Niro, Zac Efron, Zoey Deutch, Aubrey Plaza",2016,102,6.0,75137,35.54,18.0,"Título: Dirty Grandpa. Géneros: Comedy. Director: Dan Mazer. Actores: Robert De Niro, Zac Efron, Zoey Deutch, Aubrey Plaza. Año: 2016. Rating: 6.0. Sinopsis: Right before his wedding, an uptight guy is tricked into driving his grandfather, a lecherous former Army Lieutenant-Colonel, to Florida for spring break.."
268,Cloud Atlas,"Drama,Sci-Fi","An exploration of how the actions of individual lives impact one another in the past, present and future, as one soul is shaped from a killer into a hero, and an act of kindness ripples across centuries to inspire a revolution.",Tom Tykwer,"Tom Hanks, Halle Berry, Hugh Grant, Hugo Weaving",2012,172,7.5,298651,27.1,55.0,"Título: Cloud Atlas. Géneros: Drama,Sci-Fi. Director: Tom Tykwer. Actores: Tom Hanks, Halle Berry, Hugh Grant, Hugo Weaving. Año: 2012. Rating: 7.5. Sinopsis: An exploration of how the actions of individual lives impact one another in the past, present and future, as one soul is shaped from a killer into a hero, and an act of kindness ripples across centuries to inspire a revolution.."
269,X-Men Origins: Wolverine,"Action,Adventure,Sci-Fi","A look at Wolverine's early life, in particular his time with the government squad Team X and the impact it will have on his later years.",Gavin Hood,"Hugh Jackman, Liev Schreiber, Ryan Reynolds, Danny Huston",2009,107,6.7,388447,179.88,40.0,"Título: X-Men Origins: Wolverine. Géneros: Action,Adventure,Sci-Fi. Director: Gavin Hood. Actores: Hugh Jackman, Liev Schreiber, Ryan Reynolds, Danny Huston. Año: 2009. Rating: 6.7. Sinopsis: A look at Wolverine's early life, in particular his time with the government squad Team X and the impact it will have on his later years.."
270,Satanic,Horror,"Four friends on their way to Coachella stop off in Los Angeles to tour true-crime occult sites, only to encounter a mysterious young runaway who puts them on a terrifying path to ultimate horror.",Jeffrey G. Hunt,"Sarah Hyland, Steven Krueger, Justin Chon, Clara Mamet",2016,85,3.7,2384,,,"Título: Satanic. Géneros: Horror. Director: Jeffrey G. Hunt. Actores: Sarah Hyland, Steven Krueger, Justin Chon, Clara Mamet. Año: 2016. Rating: 3.7. Sinopsis: Four friends on their way to Coachella stop off in Los Angeles to tour true-crime occult sites, only to encounter a mysterious young runaway who puts them on a terrifying path to ultimate horror.."
