rank,title,genre,description,director,actors,year,runtime,rating,votes,revenue,metascore,text
735,Mr. Church,"Comedy,Drama","""Mr. Church"" tells the story of a unique friendship that develops when a little girl and her dying mother retain the services of a talented cook - Henry Joseph Church. What begins as a six month arrangement instead spans into fifteen years and creates a family bond that lasts forever.",Bruce Beresford,"Eddie Murphy, Britt Robertson, Natascha McElhone, Xavier Samuel",2016,104,7.7,16163,0.69,37.0,"Título: Mr. Church. Géneros: Comedy,Drama. Director: Bruce Beresford. Actores: Eddie Murphy, Britt Robertson, Natascha McElhone, Xavier Samuel. Año: 2016. Rating: 7.7. Sinopsis: ""Mr. Church"" tells the story of a unique friendship that develops when a little girl and her dying mother retain the services of a talented cook - Henry Joseph Church. What begins as a six month arrangement instead spans into fifteen years and creates a family bond that lasts forever.."
736,Hugo,"Adventure,Drama,Family","In Paris in 1931, an orphan named Hugo Cabret who lives in the walls of a train station is wrapped up in a mystery involving his late father and an automaton.",Martin Scorsese,"Asa Butterfield, Chloë Grace Moretz, Christopher Lee, Ben Kingsley",2011,126,7.5,259182,73.82,83.0,"Título: Hugo. Géneros: Adventure,Drama,Family. Director: Martin Scorsese. Actores: Asa Butterfield, Chloë Grace Moretz, Christopher Lee, Ben Kingsley. Año: 2011. Rating: 7.5. Sinopsis: In Paris in 1931, an orphan named Hugo Cabret who lives in the walls of a train station is wrapped up in a mystery involving his late father and an automaton.."
737,The Blackcoat's Daughter,"Horror,Thriller",Two girls must battle a mysterious evil force when they get left behind at their boarding school over winter break.,Oz Perkins,"Emma Roberts, Kiernan Shipka, Lauren Holly, Lucy Boynton",2015,93,5.6,4155,0.02,68.0,"Título: The Blackcoat's Daughter. Géneros: Horror,Thriller. Director: Oz Perkins. Actores: Emma Roberts, Kiernan Shipka, Lauren Holly, Lucy Boynton. Año: 2015. Rating: 5.6. Sinopsis: Two girls must battle a mysterious evil force when they get left behind at their boarding school over winter break.."
738,Body of Lies,"Action,Drama,Romance",A CIA agent on the ground in Jordan hunts down a powerful terrorist leader while being caught between the unclear intentions of his American supervisors and Jordan Intelligence.,Ridley Scott,"Leonardo DiCaprio, Russell Crowe, Mark Strong,Golshifteh Farahani",2008,128,7.1,182305,39.38,57.0,"Título: Body of Lies. Géneros: Action,Drama,Romance. Director: Ridley Scott. Actores: Leonardo DiCaprio, Russell Crowe, Mark Strong,Golshifteh Farahani. Año: 2008. Rating: 7.1. Sinopsis: A CIA agent on the ground in Jordan hunts down a powerful terrorist leader while being caught between the unclear intentions of his American supervisors and Jordan Intelligence.."
739,Knight of Cups,"Drama,Romance",A writer indulging in all that Los Angeles and Las Vegas has to offer undertakes a search for love and self via a series of adventures with six different women.,Terrence Malick,"Christian Bale, Cate Blanchett, Natalie Portman,Brian Dennehy",2015,118,5.7,17439,0.56,53.0,"Título: Knight of Cups. Géneros: Drama,Romance. Director: Terrence Malick. Actores: Christian Bale, Cate Blanchett, Natalie Portman,Brian Dennehy. Año: 2015. Rating: 5.7. Sinopsis: A writer indulging in all that Los Angeles and Las Vegas has to offer undertakes a search for love and self via a series of adventures with six different women.."
740,The Mummy: Tomb of the Dragon Emperor,"Action,Adventure,Fantasy","In the Far East, Alex O'Connell, the son of famed mummy fighters Rick and Evy O'Connell, unearths the mummy of the first Emperor of Qin -- a shape-shifting entity cursed by a witch centuries ago.",Rob Cohen,"Brendan Fraser, Jet Li, Maria Bello, Michelle Yeoh",2008,112,5.2,124554,102.18,31.0,"Título: The Mummy: Tomb of the Dragon Emperor. Géneros: Action,Adventure,Fantasy. Director: Rob Cohen. Actores: Brendan Fraser, Jet Li, Maria Bello, Michelle Yeoh. Año: 2008. Rating: 5.2. Sinopsis: In the Far East, Alex O'Connell, the son of famed mummy fighters Rick and Evy O'Connell, unearths the mummy of the first Emperor of Qin -- a shape-shifting entity cursed by a witch centuries ago.."
741,The Boss,Comedy,"A titan of industry is sent to prison after she's caught insider trading. When she emerges ready to rebrand herself as America's latest sweetheart, not everyone she screwed over is so quick to forgive and forget.",Ben Falcone,"Melissa McCarthy, Kristen Bell, Peter Dinklage, Ella Anderson",2016,99,5.4,29642,63.03,40.0,"Título: The Boss. Géneros: Comedy. Director: Ben Falcone. Actores: Melissa McCarthy, Kristen Bell, Peter Dinklage, Ella Anderson. Año: 2016. Rating: 5.4. Sinopsis: A titan of industry is sent to prison after she's caught insider trading. When she emerges ready to rebrand herself as America's latest sweetheart, not everyone she screwed over is so quick to forgive and forget.."
742,Hands of Stone,"Action,Biography,Drama",The legendary Roberto Duran and his equally legendary trainer Ray Arcel change each other's lives.,Jonathan Jakubowicz,"Edgar Ramírez, Usher Raymond, Robert De Niro, Rubén Blades",2016,111,6.6,8998,4.71,54.0,"Título: Hands of Stone. Géneros: Action,Biography,Drama. Director: Jonathan Jakubowicz. Actores: Edgar Ramírez, Usher Raymond, Robert De Niro, Rubén Blades. Año: 2016. Rating: 6.6. Sinopsis: The legendary Roberto Duran and his equally legendary trainer Ray Arcel change each other's lives.."
743,El secreto de sus ojos,"Drama,Mystery,Romance",A retired legal counselor writes a novel hoping to find closure for one of his past unresolved homicide cases and for his unreciprocated love with his superior - both of which still haunt him decades later.,Juan José Campanella,"Ricardo Darín, Soledad Villamil, Pablo Rago,Carla Quevedo",2009,129,8.2,144524,20.17,80.0,"Título: El secreto de sus ojos. Géneros: Drama,Mystery,Romance. Director: Juan José Campanella. Actores: Ricardo Darín, Soledad Villamil, Pablo Rago,Carla Quevedo. Año: 2009. Rating: 8.2. Sinopsis: A retired legal counselor writes a novel hoping to find closure for one of his past unresolved homicide cases and for his unreciprocated love with his superior - both of which still haunt him decades later.."
744,True Grit,"Adventure,Drama,Western",A tough U.S. Marshal helps a stubborn teenager track down her father's murderer.,Ethan Coen,"Jeff Bridges, Matt Damon, Hailee Steinfeld,Josh Brolin",2010,110,7.6,254904,171.03,80.0,"Título: True Grit. Géneros: Adventure,Drama,Western. Director: Ethan Coen. Actores: Jeff Bridges, Matt Damon, Hailee Steinfeld,Josh Brolin. Año: 2010. Rating: 7.6. Sinopsis: A tough U.S. Marshal helps a stubborn teenager track down her father's murderer.."
745,We Are Your Friends,"Drama,Music,Romance","Caught between a forbidden romance and the expectations of his friends, aspiring DJ Cole Carter attempts to find the path in life that leads to fame and fortune.",Max Joseph,"Zac Efron, Wes Bentley, Emily Ratajkowski, Jonny Weston",2015,96,6.2,25903,3.59,46.0,"Título: We Are Your Friends. Géneros: Drama,Music,Romance. Director: Max Joseph. Actores: Zac Efron, Wes Bentley, Emily Ratajkowski, Jonny Weston. Año: 2015. Rating: 6.2. Sinopsis: Caught between a forbidden romance and the expectations of his friends, aspiring DJ Cole Carter attempts to find the path in life that leads to fame and fortune.."
746,A Million Ways to Die in the West,"Comedy,Romance,Western","As a cowardly farmer begins to fall for the mysterious new woman in town, he must put his new-found courage to the test when her husband, a notorious gun-slinger, announces his arrival.",Seth MacFarlane,"Seth MacFarlane, Charlize Theron, Liam Neeson,Amanda Seyfried",2014,116,6.1,144779,42.62,44.0,"Título: A Million Ways to Die in the West. Géneros: Comedy,Romance,Western. Director: Seth MacFarlane. Actores: Seth MacFarlane, Charlize Theron, Liam Neeson,Amanda Seyfried. Año: 2014. Rating: 6.1. Sinopsis: As a cowardly farmer begins to fall for the mysterious new woman in town, he must put his new-found courage to the test when her husband, a notorious gun-slinger, announces his arrival.."
747,Only for One Night,Thriller,A married womans husband with a perfect life cheats with her sister with extreme consequences befalling them all.,Chris Stokes,"Brian White, Karrueche Tran, Angelique Pereira,Jessica Vanessa DeLeon",2016,86,4.6,313,,60.0,"Título: Only for One Night. Géneros: Thriller. Director: Chris Stokes. Actores: Brian White, Karrueche Tran, Angelique Pereira,Jessica Vanessa DeLeon. Año: 2016. Rating: 4.6. Sinopsis: A married womans husband with a perfect life cheats with her sister with extreme consequences befalling them all.."
748,Rules Don't Apply,"Comedy,Drama,Romance","The unconventional love story of an aspiring actress, her determined driver, and their boss, eccentric billionaire Howard Hughes.",Warren Beatty,"Lily Collins, Haley Bennett, Taissa Farmiga, Steve Tom",2016,127,5.7,3731,3.65,,"Título: Rules Don't Apply. Géneros: Comedy,Drama,Romance. Director: Warren Beatty. Actores: Lily Collins, Haley Bennett, Taissa Farmiga, Steve Tom. Año: 2016. Rating: 5.7. Sinopsis: The unconventional love story of an aspiring actress, her determined driver, and their boss, eccentric billionaire Howard Hughes.."
749,Ouija: Origin of Evil,"Horror,Thriller","In 1967 Los Angeles, a widowed mother and her 2 daughters add a new stunt to bolster their seance scam business, inviting an evil presence into their home.",Mike Flanagan,"Elizabeth Reaser, Lulu Wilson, Annalise Basso,Henry Thomas",2016,99,6.1,30035,34.9,65.0,"Título: Ouija: Origin of Evil. Géneros: Horror,Thriller. Director: Mike Flanagan. Actores: Elizabeth Reaser, Lulu Wilson, Annalise Basso,Henry Thomas. Año: 2016. Rating: 6.1. Sinopsis: In 1967 Los Angeles, a widowed mother and her 2 daughters add a new stunt to bolster their seance scam business, inviting an evil presence into their home.."
750,Percy Jackson: Sea of Monsters,"Adventure,Family,Fantasy","In order to restore their dying safe haven, the son of Poseidon and his friends embark on a quest to the Sea of Monsters to find the mythical Golden Fleece while trying to stop an ancient evil from rising.",Thor Freudenthal,"Logan Lerman, Alexandra Daddario, Brandon T. Jackson, Nathan Fillion",2013,106,5.9,91684,68.56,39.0,"Título: Percy Jackson: Sea of Monsters. Géneros: Adventure,Family,Fantasy. Director: Thor Freudenthal. Actores: Logan Lerman, Alexandra Daddario, Brandon T. Jackson, Nathan Fillion. Año: 2013. Rating: 5.9. Sinopsis: In order to restore their dying safe haven, the son of Poseidon and his friends embark on a quest to the Sea of Monsters to find the mythical Golden Fleece while trying to stop an ancient evil from rising.."
751,Fracture,"Crime,Drama,Mystery","An attorney, intent on climbing the career ladder toward success, finds an unlikely opponent in a manipulative criminal he is trying to prosecute.",Gregory Hoblit,"Anthony Hopkins, Ryan Gosling, David Strathairn,Rosamund Pike",2007,113,7.2,148943,39.0,68.0,"Título: Fracture. Géneros: Crime,Drama,Mystery. Director: Gregory Hoblit. Actores: Anthony Hopkins, Ryan Gosling, David Strathairn,Rosamund Pike. Año: 2007. Rating: 7.2. Sinopsis: An attorney, intent on climbing the career ladder toward success, finds an unlikely opponent in a manipulative criminal he is trying to prosecute.."
752,Oculus,"Horror,Mystery","A woman tries to exonerate her brother, who was convicted of murder, by proving that the crime was committed by a supernatural phenomenon.",Mike Flanagan,"Karen Gillan, Brenton Thwaites, Katee Sackhoff,Rory Cochrane",2013,104,6.5,92875,27.69,61.0,"Título: Oculus. Géneros: Horror,Mystery. Director: Mike Flanagan. Actores: Karen Gillan, Brenton Thwaites, Katee Sackhoff,Rory Cochrane. Año: 2013. Rating: 6.5. Sinopsis: A woman tries to exonerate her brother, who was convicted of murder, by proving that the crime was committed by a supernatural phenomenon.."
753,In Bruges,"Comedy,Crime,Drama","Guilt-stricken after a job gone wrong, hitman Ray and his partner await orders from their ruthless boss in Bruges, Belgium, the last place in the world Ray wants to be.",Martin McDonagh,"Colin Farrell, Brendan Gleeson, Ciarán Hinds,Elizabeth Berrington",2008,107,7.9,322536,7.76,67.0,"Título: In Bruges. Géneros: Comedy,Crime,Drama. Director: Martin McDonagh. Actores: Colin Farrell, Brendan Gleeson, Ciarán Hinds,Elizabeth Berrington. Año: 2008. Rating: 7.9. Sinopsis: Guilt-stricken after a job gone wrong, hitman Ray and his partner await orders from their ruthless boss in Bruges, Belgium, the last place in the world Ray wants to be.."
754,This Means War,"Action,Comedy,Romance",Two top CIA operatives wage an epic battle against one another after they discover they are dating the same woman.,McG,"Reese Witherspoon, Chris Pine, Tom Hardy, Til Schweiger",2012,103,6.3,154400,54.76,31.0,"Título: This Means War. Géneros: Action,Comedy,Romance. Director: McG. Actores: Reese Witherspoon, Chris Pine, Tom Hardy, Til Schweiger. Año: 2012. Rating: 6.3. Sinopsis: Two top CIA operatives wage an epic battle against one another after they discover they are dating the same woman.."
755,Lída Baarová,"Biography,Drama,History",A film about the black-and-white era actress Lída Baarová and her doomed love affair.,Filip Renc,"Tatiana Pauhofová, Karl Markovics, Gedeon Burkhard,Simona Stasová",2016,106,5.0,353,,64.0,"Título: Lída Baarová. Géneros: Biography,Drama,History. Director: Filip Renc. Actores: Tatiana Pauhofová, Karl Markovics, Gedeon Burkhard,Simona Stasová. Año: 2016. Rating: 5.0. Sinopsis: A film about the black-and-white era actress Lída Baarová and her doomed love affair.."
756,The Road,"Adventure,Drama","In a dangerous post-apocalyptic world, an ailing father defends his son as they slowly travel to the sea.",John Hillcoat,"Viggo Mortensen, Charlize Theron, Kodi Smit-McPhee,Robert Duvall",2009,111,7.3,187302,0.06,,"Título: The Road. Géneros: Adventure,Drama. Director: John Hillcoat. Actores: Viggo Mortensen, Charlize Theron, Kodi Smit-McPhee,Robert Duvall. Año: 2009. Rating: 7.3. Sinopsis: In a dangerous post-apocalyptic world, an ailing father defends his son as they slowly travel to the sea.."
757,Lavender,"Drama,Thriller","After losing her memory, a woman begins to see unexplained things after her psychiatrist suggests she visit her childhood home.",Ed Gass-Donnelly,"Abbie Cornish, Dermot Mulroney, Justin Long,Diego Klattenhoff",2016,92,5.2,2083,,46.0,"Título: Lavender. Géneros: Drama,Thriller. Director: Ed Gass-Donnelly. Actores: Abbie Cornish, Dermot Mulroney, Justin Long,Diego Klattenhoff. Año: 2016. Rating: 5.2. Sinopsis: After losing her memory, a woman begins to see unexplained things after her psychiatrist suggests she visit her childhood home.."
758,Deuces,Drama,An agent infiltrates a crime ring ran by a charismatic boss.,Jamal Hill,"Larenz Tate, Meagan Good, Rotimi, Rick Gonzalez",2016,87,6.6,256,,36.0,"Título: Deuces. Géneros: Drama. Director: Jamal Hill. Actores: Larenz Tate, Meagan Good, Rotimi, Rick Gonzalez. Año: 2016. Rating: 6.6. Sinopsis: An agent infiltrates a crime ring ran by a charismatic boss.."
759,Conan the Barbarian,"Action,Adventure,Fantasy",A vengeful barbarian warrior sets off to get his revenge on the evil warlord who attacked his village and murdered his father when he was a boy.,Marcus Nispel,"Jason Momoa, Ron Perlman, Rose McGowan,Stephen Lang",2011,113,5.2,84893,21.27,,"Título: Conan the Barbarian. Géneros: Action,Adventure,Fantasy. Director: Marcus Nispel. Actores: Jason Momoa, Ron Perlman, Rose McGowan,Stephen Lang. Año: 2011. Rating: 5.2. Sinopsis: A vengeful barbarian warrior sets off to get his revenge on the evil warlord who attacked his village and murdered his father when he was a boy.."
760,The Fighter,"Action,Biography,Drama","A look at the early years of boxer ""Irish"" Micky Ward and his brother who helped train him before going pro in the mid 1980s.",David O. Russell,"Mark Wahlberg, Christian Bale, Amy Adams,Melissa Leo",2010,116,7.8,290056,93.57,79.0,"Título: The Fighter. Géneros: Action,Biography,Drama. Director: David O. Russell. Actores: Mark Wahlberg, Christian Bale, Amy Adams,Melissa Leo. Año: 2010. Rating: 7.8. Sinopsis: A look at the early years of boxer ""Irish"" Micky Ward and his brother who helped train him before going pro in the mid 1980s.."
761,August Rush,"Drama,Music","A drama with fairy tale elements, where an orphaned musical prodigy uses his gift as a clue to finding his birth parents.",Kirsten Sheridan,"Freddie Highmore, Keri Russell, Jonathan Rhys Meyers, Terrence Howard",2007,114,7.5,91229,31.66,38.0,"Título: August Rush. Géneros: Drama,Music. Director: Kirsten Sheridan. Actores: Freddie Highmore, Keri Russell, Jonathan Rhys Meyers, Terrence Howard. Año: 2007. Rating: 7.5. Sinopsis: A drama with fairy tale elements, where an orphaned musical prodigy uses his gift as a clue to finding his birth parents.."
762,Chef,"Comedy,Drama","A head chef quits his restaurant job and buys a food truck in an effort to reclaim his creative promise, while piecing back together his estranged family.",Jon Favreau,"Jon Favreau, Robert Downey Jr., Scarlett Johansson,Dustin Hoffman",2014,114,7.3,151970,31.24,68.0,"Título: Chef. Géneros: Comedy,Drama. Director: Jon Favreau. Actores: Jon Favreau, Robert Downey Jr., Scarlett Johansson,Dustin Hoffman. Año: 2014. Rating: 7.3. Sinopsis: A head chef quits his restaurant job and buys a food truck in an effort to reclaim his creative promise, while piecing back together his estranged family.."
763,Eye in the Sky,"Drama,Thriller,War","Col. Katherine Powell, a military officer in command of an operation to capture terrorists in Kenya, sees her mission escalate when a girl enters the kill zone triggering an international dispute over the implications of modern warfare.",Gavin Hood,"Helen Mirren, Aaron Paul, Alan Rickman, Barkhad Abdi",2015,102,7.3,57826,18.7,73.0,"Título: Eye in the Sky. Géneros: Drama,Thriller,War. Director: Gavin Hood. Actores: Helen Mirren, Aaron Paul, Alan Rickman, Barkhad Abdi. Año: 2015. Rating: 7.3. Sinopsis: Col. Katherine Powell, a military officer in command of an operation to capture terrorists in Kenya, sees her mission escalate when a girl enters the kill zone triggering an international dispute over the implications of modern warfare.."
764,Eagle Eye,"Action,Mystery,Thriller","Jerry and Rachel are two strangers thrown together by a mysterious phone call from a woman they have never met. Threatening their lives and family, she pushes Jerry and Rachel into a series of increasingly dangerous situations, using the technology of everyday life to track and control their every move.",D.J. Caruso,"Shia LaBeouf, Michelle Monaghan, Rosario Dawson,Michael Chiklis",2008,118,6.6,156158,101.11,43.0,"Título: Eagle Eye. Géneros: Action,Mystery,Thriller. Director: D.J. Caruso. Actores: Shia LaBeouf, Michelle Monaghan, Rosario Dawson,Michael Chiklis. Año: 2008. Rating: 6.6. Sinopsis: Jerry and Rachel are two strangers thrown together by a mysterious phone call from a woman they have never met. Threatening their lives and family, she pushes Jerry and Rachel into a series of increasingly dangerous situations, using the technology of everyday life to track and control their every move.."
765,The Purge,"Horror,Sci-Fi,Thriller","A wealthy family are held hostage for harboring the target of a murderous syndicate during the Purge, a 12-hour period in which any and all crime is legal.",James DeMonaco,"Ethan Hawke, Lena Headey, Max Burkholder,Adelaide Kane",2013,85,5.7,154588,64.42,41.0,"Título: The Purge. Géneros: Horror,Sci-Fi,Thriller. Director: James DeMonaco. Actores: Ethan Hawke, Lena Headey, Max Burkholder,Adelaide Kane. Año: 2013. Rating: 5.7. Sinopsis: A wealthy family are held hostage for harboring the target of a murderous syndicate during the Purge, a 12-hour period in which any and all crime is legal.."
766,PK,"Comedy,Drama,Romance","A stranger in the city asks questions no one has asked before. His childlike curiosity will take him on a journey of love, laughter, and letting go.",Rajkumar Hirani,"Aamir Khan, Anushka Sharma, Sanjay Dutt,Boman Irani",2014,153,8.2,103279,10.57,51.0,"Título: PK. Géneros: Comedy,Drama,Romance. Director: Rajkumar Hirani. Actores: Aamir Khan, Anushka Sharma, Sanjay Dutt,Boman Irani. Año: 2014. Rating: 8.2. Sinopsis: A stranger in the city asks questions no one has asked before. His childlike curiosity will take him on a journey of love, laughter, and letting go.."
767,Ender's Game,"Action,Sci-Fi","Young Ender Wiggin is recruited by the International Military to lead the fight against the Formics, a genocidal alien race which nearly annihilated the human race in a previous invasion.",Gavin Hood,"Harrison Ford, Asa Butterfield, Hailee Steinfeld, Abigail Breslin",2013,114,6.7,194236,61.66,,"Título: Ender's Game. Géneros: Action,Sci-Fi. Director: Gavin Hood. Actores: Harrison Ford, Asa Butterfield, Hailee Steinfeld, Abigail Breslin. Año: 2013. Rating: 6.7. Sinopsis: Young Ender Wiggin is recruited by the International Military to lead the fight against the Formics, a genocidal alien race which nearly annihilated the human race in a previous invasion.."
768,Indiana Jones and the Kingdom of the Crystal Skull,"Action,Adventure,Fantasy","Famed archaeologist/adventurer Dr. Henry ""Indiana"" Jones is called back into action when he becomes entangled in a Soviet plot to uncover the secret behind mysterious artifacts known as the Crystal Skulls.",Steven Spielberg,"Harrison Ford, Cate Blanchett, Shia LaBeouf,Karen Allen",2008,122,6.2,351361,317.01,65.0,"Título: Indiana Jones and the Kingdom of the Crystal Skull. Géneros: Action,Adventure,Fantasy. Director: Steven Spielberg. Actores: Harrison Ford, Cate Blanchett, Shia LaBeouf,Karen Allen. Año: 2008. Rating: 6.2. Sinopsis: Famed archaeologist/adventurer Dr. Henry ""Indiana"" Jones is called back into action when he becomes entangled in a Soviet plot to uncover the secret behind mysterious artifacts known as the Crystal Skulls.."
769,Paper Towns,"Drama,Mystery,Romance","After an all night adventure, Quentin's life-long crush, Margo, disappears, leaving behind clues that Quentin and his friends follow on the journey of a lifetime.",Jake Schreier,"Nat Wolff, Cara Delevingne, Austin Abrams, Justice Smith",2015,109,6.3,72515,31.99,56.0,"Título: Paper Towns. Géneros: Drama,Mystery,Romance. Director: Jake Schreier. Actores: Nat Wolff, Cara Delevingne, Austin Abrams, Justice Smith. Año: 2015. Rating: 6.3. Sinopsis: After an all night adventure, Quentin's life-long crush, Margo, disappears, leaving behind clues that Quentin and his friends follow on the journey of a lifetime.."
770,High-Rise,Drama,Life for the residents of a tower block begins to run out of control.,Ben Wheatley,"Tom Hiddleston, Jeremy Irons, Sienna Miller, Luke Evans",2015,119,5.7,25928,0.34,65.0,"Título: High-Rise. Géneros: Drama. Director: Ben Wheatley. Actores: Tom Hiddleston, Jeremy Irons, Sienna Miller, Luke Evans. Año: 2015. Rating: 5.7. Sinopsis: Life for the residents of a tower block begins to run out of control.."
771,Quantum of Solace,"Action,Adventure,Thriller","James Bond descends into mystery as he tries to stop a mysterious organization from eliminating a country's most valuable resource. All the while, he still tries to seek revenge over the death of his love.",Marc Forster,"Daniel Craig, Olga Kurylenko, Mathieu Amalric, Judi Dench",2008,106,6.6,347798,168.37,58.0,"Título: Quantum of Solace. Géneros: Action,Adventure,Thriller. Director: Marc Forster. Actores: Daniel Craig, Olga Kurylenko, Mathieu Amalric, Judi Dench. Año: 2008. Rating: 6.6. Sinopsis: James Bond descends into mystery as he tries to stop a mysterious organization from eliminating a country's most valuable resource. All the while, he still tries to seek revenge over the death of his love.."
772,The Assignment,"Action,Crime,Thriller","After waking up and discovering that he has undergone gender reassignment surgery, an assassin seeks to find the doctor responsible.",Walter Hill,"Sigourney Weaver, Michelle Rodriguez, Tony Shalhoub,Anthony LaPaglia",2016,95,4.5,2043,,34.0,"Título: The Assignment. Géneros: Action,Crime,Thriller. Director: Walter Hill. Actores: Sigourney Weaver, Michelle Rodriguez, Tony Shalhoub,Anthony LaPaglia. Año: 2016. Rating: 4.5. Sinopsis: After waking up and discovering that he has undergone gender reassignment surgery, an assassin seeks to find the doctor responsible.."
773,How to Train Your Dragon,"Animation,Action,Adventure","A hapless young Viking who aspires to hunt dragons becomes the unlikely friend of a young dragon himself, and learns there may be more to the creatures than he assumed.",Dean DeBlois,"Jay Baruchel, Gerard Butler,Christopher Mintz-Plasse, Craig Ferguson",2010,98,8.1,523893,217.39,74.0,"Título: How to Train Your Dragon. Géneros: Animation,Action,Adventure. Director: Dean DeBlois. Actores: Jay Baruchel, Gerard Butler,Christopher Mintz-Plasse, Craig Ferguson. Año: 2010. Rating: 8.1. Sinopsis: A hapless young Viking who aspires to hunt dragons becomes the unlikely friend of a young dragon himself, and learns there may be more to the creatures than he assumed.."
