rank,title,genre,description,director,actors,year,runtime,rating,votes,revenue,metascore,text
460,Revolutionary Road,"Drama,Romance",A young couple living in a Connecticut suburb during the mid-1950s struggle to come to terms with their personal problems while trying to raise their two children.,Sam Mendes,"Leonardo DiCaprio, Kate Winslet, Christopher Fitzgerald, Jonathan Roumie",2008,119,7.3,159736,22.88,69.0,"Título: Revolutionary Road. Géneros: Drama,Romance. Director: Sam Mendes. Actores: Leonardo DiCaprio, Kate Winslet, Christopher Fitzgerald, Jonathan Roumie. Año: 2008. Rating: 7.3. Sinopsis: A young couple living in a Connecticut suburb during the mid-1950s struggle to come to terms with their personal problems while trying to raise their two children.."
461,The Town,"Crime,Drama,Thriller","As he plans his next job, a longtime thief tries to balance his feelings for a bank manager connected to one of his earlier heists, as well as the FBI agent looking to bring him and his crew down.",Ben Affleck,"Ben Affleck, Rebecca Hall, Jon Hamm, Jeremy Renner",2010,125,7.6,294553,92.17,74.0,"Título: The Town. Géneros: Crime,Drama,Thriller. Director: Ben Affleck. Actores: Ben Affleck, Rebecca Hall, Jon Hamm, Jeremy Renner. Año: 2010. Rating: 7.6. Sinopsis: As he plans his next job, a longtime thief tries to balance his feelings for a bank manager connected to one of his earlier heists, as well as the FBI agent looking to bring him and his crew down.."
462,The Boy,"Horror,Mystery,Thriller","An American nanny is shocked that her new English family's boy is actually a life-sized doll. After she violates a list of strict rules, disturbing events make her believe that the doll is really alive.",William Brent Bell,"Lauren Cohan, Rupert Evans, James Russell, Jim Norton",2016,97,6.0,51235,35.79,42.0,"Título: The Boy. Géneros: Horror,Mystery,Thriller. Director: William Brent Bell. Actores: Lauren Cohan, Rupert Evans, James Russell, Jim Norton. Año: 2016. Rating: 6.0. Sinopsis: An American nanny is shocked that her new English family's boy is actually a life-sized doll. After she violates a list of strict rules, disturbing events make her believe that the doll is really alive.."
463,Denial,"Biography,Drama","Acclaimed writer and historian Deborah E. Lipstadt must battle for historical truth to prove the Holocaust actually occurred when David Irving, a renowned denier, sues her for libel.",Mick Jackson,"Rachel Weisz, Tom Wilkinson, Timothy Spall, Andrew Scott",2016,109,6.6,8229,4.07,63.0,"Título: Denial. Géneros: Biography,Drama. Director: Mick Jackson. Actores: Rachel Weisz, Tom Wilkinson, Timothy Spall, Andrew Scott. Año: 2016. Rating: 6.6. Sinopsis: Acclaimed writer and historian Deborah E. Lipstadt must battle for historical truth to prove the Holocaust actually occurred when David Irving, a renowned denier, sues her for libel.."
464,Predestination,"Drama,Mystery,Sci-Fi","For his final assignment, a top temporal agent must pursue the one criminal that has eluded him throughout time. The chase turns into a unique, surprising and mind-bending exploration of love, fate, identity and time travel taboos.",Michael Spierig,"Ethan Hawke, Sarah Snook, Noah Taylor, Madeleine West",2014,97,7.5,187760,,69.0,"Título: Predestination. Géneros: Drama,Mystery,Sci-Fi. Director: Michael Spierig. Actores: Ethan Hawke, Sarah Snook, Noah Taylor, Madeleine West. Año: 2014. Rating: 7.5. Sinopsis: For his final assignment, a top temporal agent must pursue the one criminal that has eluded him throughout time. The chase turns into a unique, surprising and mind-bending exploration of love, fate, identity and time travel taboos.."
465,Goosebumps,"Adventure,Comedy,Family","A teenager teams up with the daughter of young adult horror author R. L. Stine after the writer's imaginary demons are set free on the town of Madison, Delaware.",Rob Letterman,"Jack Black, Dylan Minnette, Odeya Rush, Ryan Lee",2015,103,6.3,57602,80.02,60.0,"Título: Goosebumps. Géneros: Adventure,Comedy,Family. Director: Rob Letterman. Actores: Jack Black, Dylan Minnette, Odeya Rush, Ryan Lee. Año: 2015. Rating: 6.3. Sinopsis: A teenager teams up with the daughter of young adult horror author R. L. Stine after the writer's imaginary demons are set free on the town of Madison, Delaware.."
466,Sherlock Holmes: A Game of Shadows,"Action,Adventure,Crime","Sherlock Holmes and his sidekick Dr. Watson join forces to outwit and bring down their fiercest adversary, Professor Moriarty.",Guy Ritchie,"Robert Downey Jr., Jude Law, Jared Harris, Rachel McAdams",2011,129,7.5,357436,186.83,48.0,"Título: Sherlock Holmes: A Game of Shadows. Géneros: Action,Adventure,Crime. Director: Guy Ritchie. Actores: Robert Downey Jr., Jude Law, Jared Harris, Rachel McAdams. Año: 2011. Rating: 7.5. Sinopsis: Sherlock Holmes and his sidekick Dr. Watson join forces to outwit and bring down their fiercest adversary, Professor Moriarty.."
467,Salt,"Action,Crime,Mystery",A CIA agent goes on the run after a defector accuses her of being a Russian spy.,Phillip Noyce,"Angelina Jolie, Liev Schreiber, Chiwetel Ejiofor, Daniel Olbrychski",2010,100,6.4,255813,118.31,65.0,"Título: Salt. Géneros: Action,Crime,Mystery. Director: Phillip Noyce. Actores: Angelina Jolie, Liev Schreiber, Chiwetel Ejiofor, Daniel Olbrychski. Año: 2010. Rating: 6.4. Sinopsis: A CIA agent goes on the run after a defector accuses her of being a Russian spy.."
468,Enemy,"Mystery,Thriller",A man seeks out his exact look-alike after spotting him in a movie.,Denis Villeneuve,"Jake Gyllenhaal, Mélanie Laurent, Sarah Gadon,Isabella Rossellini",2013,91,6.9,111558,1.01,61.0,"Título: Enemy. Géneros: Mystery,Thriller. Director: Denis Villeneuve. Actores: Jake Gyllenhaal, Mélanie Laurent, Sarah Gadon,Isabella Rossellini. Año: 2013. Rating: 6.9. Sinopsis: A man seeks out his exact look-alike after spotting him in a movie.."
469,District 9,"Action,Sci-Fi,Thriller",An extraterrestrial race forced to live in slum-like conditions on Earth suddenly finds a kindred spirit in a government agent who is exposed to their biotechnology.,Neill Blomkamp,"Sharlto Copley, David James, Jason Cope, Nathalie Boltt",2009,112,8.0,556794,115.65,81.0,"Título: District 9. Géneros: Action,Sci-Fi,Thriller. Director: Neill Blomkamp. Actores: Sharlto Copley, David James, Jason Cope, Nathalie Boltt. Año: 2009. Rating: 8.0. Sinopsis: An extraterrestrial race forced to live in slum-like conditions on Earth suddenly finds a kindred spirit in a government agent who is exposed to their biotechnology.."
470,The Other Guys,"Action,Comedy,Crime",Two mismatched New York City detectives seize an opportunity to step up like the city's top cops whom they idolize -- only things don't quite go as planned.,Adam McKay,"Will Ferrell, Mark Wahlberg, Derek Jeter, Eva Mendes",2010,107,6.7,199900,119.22,64.0,"Título: The Other Guys. Géneros: Action,Comedy,Crime. Director: Adam McKay. Actores: Will Ferrell, Mark Wahlberg, Derek Jeter, Eva Mendes. Año: 2010. Rating: 6.7. Sinopsis: Two mismatched New York City detectives seize an opportunity to step up like the city's top cops whom they idolize -- only things don't quite go as planned.."
471,American Gangster,"Biography,Crime,Drama","In 1970s America, a detective works to bring down the drug empire of Frank Lucas, a heroin kingpin from Manhattan, who is smuggling the drug into the country from the Far East.",Ridley Scott,"Denzel Washington, Russell Crowe, Chiwetel Ejiofor,Josh Brolin",2007,157,7.8,337835,130.13,76.0,"Título: American Gangster. Géneros: Biography,Crime,Drama. Director: Ridley Scott. Actores: Denzel Washington, Russell Crowe, Chiwetel Ejiofor,Josh Brolin. Año: 2007. Rating: 7.8. Sinopsis: In 1970s America, a detective works to bring down the drug empire of Frank Lucas, a heroin kingpin from Manhattan, who is smuggling the drug into the country from the Far East.."
472,Marie Antoinette,"Biography,Drama,History","The retelling of France's iconic but ill-fated queen, Marie Antoinette. From her betrothal and marriage to Louis XVI at 15 to her reign as queen at 19 and to the end of her reign as queen, and ultimately the fall of Versailles.",Sofia Coppola,"Kirsten Dunst, Jason Schwartzman, Rip Torn, Judy Davis",2006,123,6.4,83941,15.96,65.0,"Título: Marie Antoinette. Géneros: Biography,Drama,History. Director: Sofia Coppola. Actores: Kirsten Dunst, Jason Schwartzman, Rip Torn, Judy Davis. Año: 2006. Rating: 6.4. Sinopsis: The retelling of France's iconic but ill-fated queen, Marie Antoinette. From her betrothal and marriage to Louis XVI at 15 to her reign as queen at 19 and to the end of her reign as queen, and ultimately the fall of Versailles.."
473,2012,"Action,Adventure,Sci-Fi",A frustrated writer struggles to keep his family alive when a series of global catastrophes threatens to annihilate mankind.,Roland Emmerich,"John Cusack, Thandie Newton, Chiwetel Ejiofor,Amanda Peet",2009,158,5.8,297984,166.11,49.0,"Título: 2012. Géneros: Action,Adventure,Sci-Fi. Director: Roland Emmerich. Actores: John Cusack, Thandie Newton, Chiwetel Ejiofor,Amanda Peet. Año: 2009. Rating: 5.8. Sinopsis: A frustrated writer struggles to keep his family alive when a series of global catastrophes threatens to annihilate mankind.."
474,Harry Potter and the Half-Blood Prince,"Adventure,Family,Fantasy","As Harry Potter begins his sixth year at Hogwarts, he discovers an old book marked as ""the property of the Half-Blood Prince"" and begins to learn more about Lord Voldemort's dark past.",David Yates,"Daniel Radcliffe, Emma Watson, Rupert Grint, Michael Gambon",2009,153,7.5,351059,301.96,78.0,"Título: Harry Potter and the Half-Blood Prince. Géneros: Adventure,Family,Fantasy. Director: David Yates. Actores: Daniel Radcliffe, Emma Watson, Rupert Grint, Michael Gambon. Año: 2009. Rating: 7.5. Sinopsis: As Harry Potter begins his sixth year at Hogwarts, he discovers an old book marked as ""the property of the Half-Blood Prince"" and begins to learn more about Lord Voldemort's dark past.."
475,Argo,"Biography,Drama,History","Acting under the cover of a Hollywood producer scouting a location for a science fiction film, a CIA agent launches a dangerous operation to rescue six Americans in Tehran during the U.S. hostage crisis in Iran in 1980.",Ben Affleck,"Ben Affleck, Bryan Cranston, John Goodman, Alan Arkin",2012,120,7.7,481274,136.02,86.0,"Título: Argo. Géneros: Biography,Drama,History. Director: Ben Affleck. Actores: Ben Affleck, Bryan Cranston, John Goodman, Alan Arkin. Año: 2012. Rating: 7.7. Sinopsis: Acting under the cover of a Hollywood producer scouting a location for a science fiction film, a CIA agent launches a dangerous operation to rescue six Americans in Tehran during the U.S. hostage crisis in Iran in 1980.."
476,Eddie the Eagle,"Biography,Comedy,Drama","The story of Eddie Edwards, the notoriously tenacious British underdog ski jumper who charmed the world at the 1988 Winter Olympics.",Dexter Fletcher,"Taron Egerton, Hugh Jackman, Tom Costello, Jo Hartley",2016,106,7.4,56332,15.79,54.0,"Título: Eddie the Eagle. Géneros: Biography,Comedy,Drama. Director: Dexter Fletcher. Actores: Taron Egerton, Hugh Jackman, Tom Costello, Jo Hartley. Año: 2016. Rating: 7.4. Sinopsis: The story of Eddie Edwards, the notoriously tenacious British underdog ski jumper who charmed the world at the 1988 Winter Olympics.."
477,The Lives of Others,"Drama,Thriller","In 1984 East Berlin, an agent of the secret police, conducting surveillance on a writer and his lover, finds himself becoming increasingly absorbed by their lives.",Florian Henckel von Donnersmarck,"Ulrich Mühe, Martina Gedeck,Sebastian Koch, Ulrich Tukur",2006,137,8.5,278103,11.28,89.0,"Título: The Lives of Others. Géneros: Drama,Thriller. Director: Florian Henckel von Donnersmarck. Actores: Ulrich Mühe, Martina Gedeck,Sebastian Koch, Ulrich Tukur. Año: 2006. Rating: 8.5. Sinopsis: In 1984 East Berlin, an agent of the secret police, conducting surveillance on a writer and his lover, finds himself becoming increasingly absorbed by their lives.."
478,Pet,"Horror,Thriller","A psychological thriller about a man who bumps into an old crush and subsequently becomes obsessed with her, leading him to hold her captive underneath the animal shelter where he works. ... See full summary »",Carles Torrens,"Dominic Monaghan, Ksenia Solo, Jennette McCurdy,Da'Vone McDonald",2016,94,5.7,8404,,48.0,"Título: Pet. Géneros: Horror,Thriller. Director: Carles Torrens. Actores: Dominic Monaghan, Ksenia Solo, Jennette McCurdy,Da'Vone McDonald. Año: 2016. Rating: 5.7. Sinopsis: A psychological thriller about a man who bumps into an old crush and subsequently becomes obsessed with her, leading him to hold her captive underneath the animal shelter where he works. ... See full summary »."
479,Paint It Black,Drama,A young woman attempts to deal with the death of her boyfriend while continuously confronted by his mentally unstable mother.,Amber Tamblyn,"Alia Shawkat, Nancy Kwan, Annabelle Attanasio,Alfred Molina",2016,96,8.3,61,,71.0,"Título: Paint It Black. Géneros: Drama. Director: Amber Tamblyn. Actores: Alia Shawkat, Nancy Kwan, Annabelle Attanasio,Alfred Molina. Año: 2016. Rating: 8.3. Sinopsis: A young woman attempts to deal with the death of her boyfriend while continuously confronted by his mentally unstable mother.."
480,Macbeth,"Drama,War","Macbeth, the Thane of Glamis, receives a prophecy from a trio of witches that one day he will become King of Scotland. Consumed by ambition and spurred to action by his wife, Macbeth murders his king and takes the throne for himself.",Justin Kurzel,"Michael Fassbender, Marion Cotillard, Jack Madigan,Frank Madigan",2015,113,6.7,41642,,71.0,"Título: Macbeth. Géneros: Drama,War. Director: Justin Kurzel. Actores: Michael Fassbender, Marion Cotillard, Jack Madigan,Frank Madigan. Año: 2015. Rating: 6.7. Sinopsis: Macbeth, the Thane of Glamis, receives a prophecy from a trio of witches that one day he will become King of Scotland. Consumed by ambition and spurred to action by his wife, Macbeth murders his king and takes the throne for himself.."
481,Forgetting Sarah Marshall,"Comedy,Drama,Romance","Devastated Peter takes a Hawaiian vacation in order to deal with the recent break-up with his TV star girlfriend, Sarah. Little does he know, Sarah's traveling to the same resort as her ex - and she's bringing along her new boyfriend.",Nicholas Stoller,"Kristen Bell, Jason Segel, Paul Rudd, Mila Kunis",2008,111,7.2,226619,62.88,67.0,"Título: Forgetting Sarah Marshall. Géneros: Comedy,Drama,Romance. Director: Nicholas Stoller. Actores: Kristen Bell, Jason Segel, Paul Rudd, Mila Kunis. Año: 2008. Rating: 7.2. Sinopsis: Devastated Peter takes a Hawaiian vacation in order to deal with the recent break-up with his TV star girlfriend, Sarah. Little does he know, Sarah's traveling to the same resort as her ex - and she's bringing along her new boyfriend.."
482,The Giver,"Drama,Romance,Sci-Fi","In a seemingly perfect community, without war, pain, suffering, differences or choice, a young boy is chosen to learn from an elderly man about the true pain and pleasure of the ""real"" world.",Phillip Noyce,"Brenton Thwaites, Jeff Bridges, Meryl Streep, Taylor Swift",2014,97,6.5,93799,45.09,47.0,"Título: The Giver. Géneros: Drama,Romance,Sci-Fi. Director: Phillip Noyce. Actores: Brenton Thwaites, Jeff Bridges, Meryl Streep, Taylor Swift. Año: 2014. Rating: 6.5. Sinopsis: In a seemingly perfect community, without war, pain, suffering, differences or choice, a young boy is chosen to learn from an elderly man about the true pain and pleasure of the ""real"" world.."
483,Triple 9,"Action,Crime,Drama",A gang of criminals and corrupt cops plan the murder of a police officer in order to pull off their biggest heist yet across town.,John Hillcoat,"Casey Affleck, Chiwetel Ejiofor, Anthony Mackie,Aaron Paul",2016,115,6.3,48400,12.63,52.0,"Título: Triple 9. Géneros: Action,Crime,Drama. Director: John Hillcoat. Actores: Casey Affleck, Chiwetel Ejiofor, Anthony Mackie,Aaron Paul. Año: 2016. Rating: 6.3. Sinopsis: A gang of criminals and corrupt cops plan the murder of a police officer in order to pull off their biggest heist yet across town.."
484,Perfetti sconosciuti,"Comedy,Drama","Seven long-time friends get together for a dinner. When they decide to share with each other the content of every text message, email and phone call they receive, many secrets start to unveil and the equilibrium trembles.",Paolo Genovese,"Giuseppe Battiston, Anna Foglietta, Marco Giallini,Edoardo Leo",2016,97,7.7,17584,,43.0,"Título: Perfetti sconosciuti. Géneros: Comedy,Drama. Director: Paolo Genovese. Actores: Giuseppe Battiston, Anna Foglietta, Marco Giallini,Edoardo Leo. Año: 2016. Rating: 7.7. Sinopsis: Seven long-time friends get together for a dinner. When they decide to share with each other the content of every text message, email and phone call they receive, many secrets start to unveil and the equilibrium trembles.."
485,Angry Birds,"Animation,Action,Adventure","Find out why the birds are so angry. When an island populated by happy, flightless birds is visited by mysterious green piggies, it's up to three unlikely outcasts - Red, Chuck and Bomb - to figure out what the pigs are up to.",Clay Kaytis,"Jason Sudeikis, Josh Gad, Danny McBride, Maya Rudolph",2016,97,6.3,55781,107.51,,"Título: Angry Birds. Géneros: Animation,Action,Adventure. Director: Clay Kaytis. Actores: Jason Sudeikis, Josh Gad, Danny McBride, Maya Rudolph. Año: 2016. Rating: 6.3. Sinopsis: Find out why the birds are so angry. When an island populated by happy, flightless birds is visited by mysterious green piggies, it's up to three unlikely outcasts - Red, Chuck and Bomb - to figure out what the pigs are up to.."
486,Moonrise Kingdom,"Adventure,Comedy,Drama","A pair of young lovers flee their New England town, which causes a local search party to fan out to find them.",Wes Anderson,"Jared Gilman, Kara Hayward, Bruce Willis, Bill Murray",2012,94,7.8,254446,45.51,84.0,"Título: Moonrise Kingdom. Géneros: Adventure,Comedy,Drama. Director: Wes Anderson. Actores: Jared Gilman, Kara Hayward, Bruce Willis, Bill Murray. Año: 2012. Rating: 7.8. Sinopsis: A pair of young lovers flee their New England town, which causes a local search party to fan out to find them.."
487,Hairspray,"Comedy,Drama,Family",Pleasantly plump teenager Tracy Turnblad teaches 1962 Baltimore a thing or two about integration after landing a spot on a local TV dance show.,Adam Shankman,"John Travolta, Queen Latifah, Nikki Blonsky,Michelle Pfeiffer",2007,117,6.7,102954,118.82,81.0,"Título: Hairspray. Géneros: Comedy,Drama,Family. Director: Adam Shankman. Actores: John Travolta, Queen Latifah, Nikki Blonsky,Michelle Pfeiffer. Año: 2007. Rating: 6.7. Sinopsis: Pleasantly plump teenager Tracy Turnblad teaches 1962 Baltimore a thing or two about integration after landing a spot on a local TV dance show.."
488,Safe Haven,"Drama,Romance,Thriller","A young woman with a mysterious past lands in Southport, North Carolina where her bond with a widower forces her to confront the dark secret that haunts her.",Lasse Hallström,"Julianne Hough, Josh Duhamel, Cobie Smulders,David Lyons",2013,115,6.7,84765,71.35,34.0,"Título: Safe Haven. Géneros: Drama,Romance,Thriller. Director: Lasse Hallström. Actores: Julianne Hough, Josh Duhamel, Cobie Smulders,David Lyons. Año: 2013. Rating: 6.7. Sinopsis: A young woman with a mysterious past lands in Southport, North Carolina where her bond with a widower forces her to confront the dark secret that haunts her.."
489,Focus,"Comedy,Crime,Drama","In the midst of veteran con man Nicky's latest scheme, a woman from his past - now an accomplished femme fatale - shows up and throws his plans for a loop.",Glenn Ficarra,"Will Smith, Margot Robbie, Rodrigo Santoro, Adrian Martinez",2015,105,6.6,166489,53.85,56.0,"Título: Focus. Géneros: Comedy,Crime,Drama. Director: Glenn Ficarra. Actores: Will Smith, Margot Robbie, Rodrigo Santoro, Adrian Martinez. Año: 2015. Rating: 6.6. Sinopsis: In the midst of veteran con man Nicky's latest scheme, a woman from his past - now an accomplished femme fatale - shows up and throws his plans for a loop.."
490,Ratatouille,"Animation,Comedy,Family",A rat who can cook makes an unusual alliance with a young kitchen worker at a famous restaurant.,Brad Bird,"Brad Garrett, Lou Romano, Patton Oswalt,Ian Holm",2007,111,8.0,504039,206.44,96.0,"Título: Ratatouille. Géneros: Animation,Comedy,Family. Director: Brad Bird. Actores: Brad Garrett, Lou Romano, Patton Oswalt,Ian Holm. Año: 2007. Rating: 8.0. Sinopsis: A rat who can cook makes an unusual alliance with a young kitchen worker at a famous restaurant.."
491,Stake Land,"Drama,Horror,Sci-Fi",Martin was a normal teenage boy before the country collapsed in an empty pit of economic and political disaster. A vampire epidemic has swept across what is left of the nation's abandoned ... See full summary »,Jim Mickle,"Connor Paolo, Nick Damici, Kelly McGillis, Gregory Jones",2010,98,6.5,36091,0.02,66.0,"Título: Stake Land. Géneros: Drama,Horror,Sci-Fi. Director: Jim Mickle. Actores: Connor Paolo, Nick Damici, Kelly McGillis, Gregory Jones. Año: 2010. Rating: 6.5. Sinopsis: Martin was a normal teenage boy before the country collapsed in an empty pit of economic and political disaster. A vampire epidemic has swept across what is left of the nation's abandoned ... See full summary »."
492,The Book of Eli,"Action,Adventure,Drama","A post-apocalyptic tale, in which a lone man fights his way across America in order to protect a sacred book that holds the secrets to saving humankind.",Albert Hughes,"Denzel Washington, Mila Kunis, Ray Stevenson, Gary Oldman",2010,118,6.9,241359,94.82,53.0,"Título: The Book of Eli. Géneros: Action,Adventure,Drama. Director: Albert Hughes. Actores: Denzel Washington, Mila Kunis, Ray Stevenson, Gary Oldman. Año: 2010. Rating: 6.9. Sinopsis: A post-apocalyptic tale, in which a lone man fights his way across America in order to protect a sacred book that holds the secrets to saving humankind.."
493,Cloverfield,"Action,Horror,Sci-Fi",A group of friends venture deep into the streets of New York on a rescue mission during a rampaging monster attack.,Matt Reeves,"Mike Vogel, Jessica Lucas, Lizzy Caplan, T.J. Miller",2008,85,7.0,313803,80.03,64.0,"Título: Cloverfield. Géneros: Action,Horror,Sci-Fi. Director: Matt Reeves. Actores: Mike Vogel, Jessica Lucas, Lizzy Caplan, T.J. Miller. Año: 2008. Rating: 7.0. Sinopsis: A group of friends venture deep into the streets of New York on a rescue mission during a rampaging monster attack.."
494,Point Break,"Action,Crime,Sport","A young FBI agent infiltrates an extraordinary team of extreme sports athletes he suspects of masterminding a string of unprecedented, sophisticated corporate heists.",Ericson Core,"Edgar Ramírez, Luke Bracey, Ray Winstone, Teresa Palmer",2015,114,5.3,44553,28.77,34.0,"Título: Point Break. Géneros: Action,Crime,Sport. Director: Ericson Core. Actores: Edgar Ramírez, Luke Bracey, Ray Winstone, Teresa Palmer. Año: 2015. Rating: 5.3. Sinopsis: A young FBI agent infiltrates an extraordinary team of extreme sports athletes he suspects of masterminding a string of unprecedented, sophisticated corporate heists.."
495,Under the Skin,"Drama,Horror,Sci-Fi","A mysterious young woman seduces lonely men in the evening hours in Scotland. However, events lead her to begin a process of self-discovery.",Jonathan Glazer,"Scarlett Johansson, Jeremy McWilliams, Lynsey Taylor Mackay, Dougie McConnell",2013,108,6.3,94707,2.61,78.0,"Título: Under the Skin. Géneros: Drama,Horror,Sci-Fi. Director: Jonathan Glazer. Actores: Scarlett Johansson, Jeremy McWilliams, Lynsey Taylor Mackay, Dougie McConnell. Año: 2013. Rating: 6.3. Sinopsis: A mysterious young woman seduces lonely men in the evening hours in Scotland. However, events lead her to begin a process of self-discovery.."
496,I Am Legend,"Drama,Horror,Sci-Fi","Years after a plague kills most of humanity and transforms the rest into monsters, the sole survivor in New York City struggles valiantly to find a cure.",Francis Lawrence,"Will Smith, Alice Braga, Charlie Tahan, Salli Richardson-Whitfield",2007,101,7.2,565721,256.39,65.0,"Título: I Am Legend. Géneros: Drama,Horror,Sci-Fi. Director: Francis Lawrence. Actores: Will Smith, Alice Braga, Charlie Tahan, Salli Richardson-Whitfield. Año: 2007. Rating: 7.2. Sinopsis: Years after a plague kills most of humanity and transforms the rest into monsters, the sole survivor in New York City struggles valiantly to find a cure.."
497,Men in Black 3,"Action,Adventure,Comedy",Agent J travels in time to M.I.B.'s early days in 1969 to stop an alien from assassinating his friend Agent K and changing history.,Barry Sonnenfeld,"Will Smith, Tommy Lee Jones, Josh Brolin,Jemaine Clement",2012,106,6.8,278379,179.02,58.0,"Título: Men in Black 3. Géneros: Action,Adventure,Comedy. Director: Barry Sonnenfeld. Actores: Will Smith, Tommy Lee Jones, Josh Brolin,Jemaine Clement. Año: 2012. Rating: 6.8. Sinopsis: Agent J travels in time to M.I.B.'s early days in 1969 to stop an alien from assassinating his friend Agent K and changing history.."
498,Super 8,"Mystery,Sci-Fi,Thriller","During the summer of 1979, a group of friends witness a train crash and investigate subsequent unexplained events in their small town.",J.J. Abrams,"Elle Fanning, AJ Michalka, Kyle Chandler, Joel Courtney",2011,112,7.1,298913,126.98,72.0,"Título: Super 8. Géneros: Mystery,Sci-Fi,Thriller. Director: J.J. Abrams. Actores: Elle Fanning, AJ Michalka, Kyle Chandler, Joel Courtney. Año: 2011. Rating: 7.1. Sinopsis: During the summer of 1979, a group of friends witness a train crash and investigate subsequent unexplained events in their small town.."
